{
  "$schema": "http://json-schema.org/draft-07/schema#",
  "title": "Cere Blockchain Chain Specification Schema",
  "description": "JSON Schema for validating Cere blockchain chain specification files",
  "type": "object",
  "required": [
    "name",
    "id",
    "chainType",
    "properties",
    "genesis"
  ],
  "properties": {
    "name": {
      "type": "string",
      "description": "Human-readable name of the chain",
      "minLength": 1,
      "maxLength": 100,
      "pattern": "^[a-zA-Z0-9\\s\\-_]+$"
    },
    "id": {
      "type": "string",
      "description": "Unique identifier for the chain",
      "minLength": 1,
      "maxLength": 50,
      "pattern": "^[a-z0-9_]+$"
    },
    "chainType": {
      "type": "string",
      "description": "Type of the blockchain network",
      "enum": [
        "Development",
        "Local",
        "Live",
        "Custom"
      ]
    },
    "bootNodes": {
      "type": "array",
      "description": "List of boot nodes for network discovery",
      "items": {
        "type": "string",
        "pattern": "^/ip[46]/[0-9a-fA-F.:]+/tcp/[0-9]+/p2p/[a-zA-Z0-9]+$"
      },
      "maxItems": 20
    },
    "telemetryEndpoints": {
      "type": "array",
      "description": "Telemetry endpoints for monitoring",
      "items": {
        "type": "array",
        "minItems": 2,
        "maxItems": 2,
        "items": [
          {
            "type": "string",
            "pattern": "^wss?://"
          },
          {
            "type": "integer",
            "minimum": 0,
            "maximum": 10
          }
        ]
      },
      "maxItems": 5
    },
    "protocolId": {
      "oneOf": [
        {
          "type": "null"
        },
        {
          "type": "string",
          "minLength": 1,
          "maxLength": 50
        }
      ]
    },
    "properties": {
      "type": "object",
      "required": [
        "ss58Format",
        "tokenDecimals",
        "tokenSymbol"
      ],
      "properties": {
        "ss58Format": {
          "type": "integer",
          "description": "SS58 address format identifier",
          "minimum": 0,
          "maximum": 16383
        },
        "tokenDecimals": {
          "type": "integer",
          "description": "Number of decimal places for the native token",
          "minimum": 0,
          "maximum": 18
        },
        "tokenSymbol": {
          "type": "string",
          "description": "Symbol of the native token",
          "minLength": 1,
          "maxLength": 10,
          "pattern": "^[A-Z]+$"
        }
      },
      "additionalProperties": false
    },
    "forkBlocks": {
      "oneOf": [
        {
          "type": "null"
        },
        {
          "type": "array",
          "items": {
            "type": "integer",
            "minimum": 0
          }
        }
      ]
    },
    "badBlocks": {
      "oneOf": [
        {
          "type": "null"
        },
        {
          "type": "array",
          "items": {
            "type": "string",
            "pattern": "^0x[a-fA-F0-9]{64}$"
          }
        }
      ]
    },
    "consensusEngine": {
      "oneOf": [
        {
          "type": "null"
        },
        {
          "type": "string",
          "enum": [
            "babe",
            "aura",
            "pow"
          ]
        }
      ]
    },
    "lightSyncState": {
      "oneOf": [
        {
          "type": "null"
        },
        {
          "type": "object"
        }
      ]
    },
    "genesis": {
      "type": "object",
      "required": [
        "raw"
      ],
      "properties": {
        "raw": {
          "type": "object",
          "required": [
            "top"
          ],
          "properties": {
            "top": {
              "type": "object",
              "description": "Genesis state storage",
              "patternProperties": {
                "^0x[a-fA-F0-9]+$": {
                  "type": "string",
                  "pattern": "^0x[a-fA-F0-9]*$"
                }
              },
              "additionalProperties": false
            },
            "childrenDefault": {
              "type": "object",
              "additionalProperties": {
                "type": "object"
              }
            }
          },
          "additionalProperties": false
        }
      },
      "additionalProperties": false
    },
    "codeSubstitutes": {
      "type": "object",
      "patternProperties": {
        "^[0-9]+$": {
          "type": "string",
          "pattern": "^0x[a-fA-F0-9]+$"
        }
      },
      "additionalProperties": false
    }
  },
  "additionalProperties": false,
  "definitions": {
    "hexString": {
      "type": "string",
      "pattern": "^0x[a-fA-F0-9]*$"
    },
    "hash": {
      "type": "string",
      "pattern": "^0x[a-fA-F0-9]{64}$"
    },
    "blockNumber": {
      "type": "integer",
      "minimum": 0
    }
  }
}