{
  "name": "Development",
  "id": "cere_dev",
  "chainType": "Development",
  "bootNodes": [],
  "telemetryEndpoints": [],
  "protocolId": "cere",
  "properties": {
    "ss58Format": 54,
    "tokenDecimals": 10,
    "tokenSymbol": "CERE"
  },
  "forkBlocks": null,
  "badBlocks": null,
  "lightSyncState": null,
  "codeSubstitutes": {},
  "genesis": {
    "raw": {
      "top": {
        "0x26aa394eea5630e07c48ae0c9558cef7b99d880ec681799c0cf30e8886371da95ecffd7b6c0f78751baa9d281e0bfa3a6d6f646c70792f74727372790000000000000000000000000000000000000000": "0x000000000000000000e40b54020000000000000000000000000000000000000000000000000000000000000000000000000000000000000000000000000000000000000000000000",
        "0x26aa394eea5630e07c48ae0c9558cef78a42f33323cb5ced3b44dd825fda9fcc": "0x4545454545454545454545454545454545454545454545454545454545454545",
        "0x5c0d1176a568c1f92944340dbfed9e9c530ebca703c85910e7164cb7d1c9e47b": "0xd0b377354ea844f3b9d22d4a1bced25b8dc9f42242ce6a06d54d5f9680101a39"
      }
    }
  }
}
